{
  "report_type": "Digital_Twin_Integrated_Report",
  "generated_at": "2026-09-10T10:45:58Z",
  "patient_profile": {
    "patient_id": null,
    "name": null,
    "date_of_birth": null,
    "sex": null,
    "age_years": null
  },
  "clinical_summary": {
    "active_problems": [
      "Overall clinical impression: seizure control reasonably stable, quality-of-life trending",
      "12-May-2021",
      "Levetiracetam (Keppra) 1000mg BID,",
      "Lamotrigine 150mg BID",
      "Focal Impaired Awareness, Secondary Generalized Tonic-Clonic",
      "Complete Blood Count (CBC) and LIVER Function Panels completed. Values stable inside Therapeutic Window.",
      "Quality-of-Life Domain Summary (0-100, higher = better)",
      "Domain",
      "Score",
      "Seizure Activity & Worry",
      "9/100",
      "Aura & Prodromal Symptoms",
      "Medication Effects & Tolerability",
      "6/100",
      "Sleep Quality & Energy",
      "Triggers Observed",
      "7/100",
      "Cognitive & Emotional Wellbeing",
      "2/100",
      "Labs, Vitals & Daily Functioning",
      "5/100",
      "Epilepsy Assessment Report — Date: 01-Jan-2026",
      "Diagnosis Date: 12-May-2021",
      "Assessment Parameter",
      "No routine lab tests scheduled for this bi-weekly window.",
      "8/100",
      "Epilepsy Assessment Report — Date: 16-Jan-2026",
      "CBC profile updated. Platelet counts normal",
      "white cell parameters steady.",
      "0/100",
      "Epilepsy Assessment Report — Date: 03-Feb-2026",
      "1/100",
      "4/100",
      "Epilepsy Assessment Report — Date: 15-Feb-2026",
      "Epilepsy Assessment Report — Date: 02-Mar-2026",
      "No acute hematological abnormality detected on this panel."
    ],
    "medications": [
      "Current Meds: Levetiracetam (Keppra) 1000mg BID,",
      "Medication Effects & Tolerability",
      "Nausea after taking medication",
      "Missed medication doses"
    ],
    "allergies": [],
    "notable_abnormalities": [
      "Overall clinical impression: seizure control reasonably stable, quality-of-life trending",
      "12-May-2021",
      "Levetiracetam (Keppra) 1000mg BID,",
      "Lamotrigine 150mg BID",
      "Focal Impaired Awareness, Secondary Generalized Tonic-Clonic",
      "Complete Blood Count (CBC) and LIVER Function Panels completed. Values stable inside Therapeutic Window.",
      "Quality-of-Life Domain Summary (0-100, higher = better)",
      "Domain",
      "Score",
      "Seizure Activity & Worry",
      "9/100",
      "Aura & Prodromal Symptoms",
      "Medication Effects & Tolerability",
      "6/100",
      "Sleep Quality & Energy",
      "Triggers Observed",
      "7/100",
      "Cognitive & Emotional Wellbeing",
      "2/100",
      "Labs, Vitals & Daily Functioning",
      "5/100",
      "Epilepsy Assessment Report — Date: 01-Jan-2026",
      "Diagnosis Date: 12-May-2021",
      "Assessment Parameter",
      "No routine lab tests scheduled for this bi-weekly window.",
      "8/100",
      "Epilepsy Assessment Report — Date: 16-Jan-2026",
      "CBC profile updated. Platelet counts normal",
      "white cell parameters steady.",
      "0/100",
      "Epilepsy Assessment Report — Date: 03-Feb-2026",
      "1/100",
      "4/100",
      "Epilepsy Assessment Report — Date: 15-Feb-2026",
      "Epilepsy Assessment Report — Date: 02-Mar-2026",
      "No acute hematological abnormality detected on this panel."
    ]
  },
  "sections": {
    "clinical_notes": {
      "chief_complaint": "Since last visit, patient reports approximately 7",
      "history_of_present_illness": "seizure episodes overall, average duration 3.4 mins, with seizure clustering: No.",
      "diagnoses": [
        "Overall clinical impression: seizure control reasonably stable, quality-of-life trending",
        "12-May-2021",
        "Levetiracetam (Keppra) 1000mg BID,",
        "Lamotrigine 150mg BID",
        "Focal Impaired Awareness, Secondary Generalized Tonic-Clonic",
        "Complete Blood Count (CBC) and LIVER Function Panels completed. Values stable inside Therapeutic Window.",
        "Quality-of-Life Domain Summary (0-100, higher = better)",
        "Domain",
        "Score",
        "Seizure Activity & Worry",
        "9/100",
        "Aura & Prodromal Symptoms",
        "Medication Effects & Tolerability",
        "6/100",
        "Sleep Quality & Energy",
        "Triggers Observed",
        "7/100",
        "Cognitive & Emotional Wellbeing",
        "2/100",
        "Labs, Vitals & Daily Functioning",
        "5/100",
        "Epilepsy Assessment Report — Date: 01-Jan-2026",
        "Diagnosis Date: 12-May-2021",
        "Assessment Parameter",
        "No routine lab tests scheduled for this bi-weekly window.",
        "8/100",
        "Epilepsy Assessment Report — Date: 16-Jan-2026",
        "CBC profile updated. Platelet counts normal",
        "white cell parameters steady.",
        "0/100",
        "Epilepsy Assessment Report — Date: 03-Feb-2026",
        "1/100",
        "4/100",
        "Epilepsy Assessment Report — Date: 15-Feb-2026",
        "Epilepsy Assessment Report — Date: 02-Mar-2026"
      ],
      "medications": [
        "Current Meds: Levetiracetam (Keppra) 1000mg BID,",
        "Medication Effects & Tolerability",
        "Nausea after taking medication",
        "Missed medication doses"
      ],
      "allergies": [],
      "plan": null,
      "notable_findings": [
        "seizure episodes overall, average duration 3.4 mins, with seizure clustering: No.",
        "Overall clinical impression: seizure control reasonably stable, quality-of-life trending",
        "Seizure History: Focal Impaired Awareness, Secondary Generalized Tonic-Clonic",
        "Seizure Activity & Worry",
        "Tonic-Clonic seizure count",
        "Absence seizure count",
        "Focal aware seizure count",
        "Focal impaired-awareness seizure count",
        "Nocturnal (sleep) seizure episodes",
        "Average seizure duration (mins)",
        "seizure episodes overall, average duration 9.0 mins, with seizure clustering: Yes.",
        "seizure episodes overall, average duration 6.7 mins, with seizure clustering: No.",
        "seizure episodes overall, average duration 8.2 mins, with seizure clustering: No.",
        "seizure episodes overall, average duration 4.5 mins, with seizure clustering: No."
      ]
    },
    "cbc": {
      "collection_date": null,
      "hemoglobin_g_per_dL": null,
      "hematocrit_pct": null,
      "rbc_million_uL": null,
      "wbc_10e3_uL": null,
      "platelets_10e3_uL": null,
      "mcv_fL": null,
      "mch_pg": null,
      "mchc_g_dL": null,
      "rdw_pct": null,
      "differential": {
        "neutrophils_pct": null,
        "lymphocytes_pct": null,
        "monocytes_pct": null,
        "eosinophils_pct": null,
        "basophils_pct": null
      },
      "abnormal_flags": [
        "No acute hematological abnormality detected on this panel."
      ]
    },
    "ct": {
      "study_date": null,
      "body_region": null,
      "indication": null,
      "contrast": null,
      "impression": null,
      "key_findings": [],
      "urgent_findings": []
    },
    "mri": {
      "study_date": null,
      "body_region": "brain",
      "indication": null,
      "contrast": null,
      "impression": null,
      "key_findings": [],
      "urgent_findings": []
    },
    "ecg": {
      "study_date": null,
      "rate_bpm": null,
      "rhythm": null,
      "intervals": {
        "pr_ms": null,
        "qrs_ms": null,
        "qt_ms": null,
        "qtc_ms": null
      },
      "axis": null,
      "impression": null,
      "notable_abnormalities": []
    },
    "eeg": {
      "study_date": null,
      "background": null,
      "epileptiform_activity": "ictal",
      "events": [],
      "impression": null,
      "notable_abnormalities": []
    },
    "genetics": {
      "test_name": null,
      "variants": [],
      "overall_interpretation": null,
      "recommendations": []
    },
    "questionnaire": {
      "reported_symptoms": [
        "Focal Impaired Awareness, Secondary Generalized Tonic-Clonic"
      ],
      "symptom_onset": null,
      "duration": "What was the average duration of the longest convulsive episode?",
      "severity": "Mild morning grogginess",
      "relevant_history": [
        "Seizure History: Focal Impaired Awareness, Secondary Generalized Tonic-Clonic",
        "Medication Side Effects",
        "Experience of dizziness, vertigo, or lightheadedness after taking medication:",
        "Presence of chronic headaches or unusual cranial pressure post-medication dose:",
        "Did you experience a delayed or completely missed dose of your anti-seizure medication?"
      ],
      "patient_concerns": [
        "Difficulty planning, organizing daily schedules, or managing simple multi-step tasks:"
      ]
    }
  },
  "source_traceability": [
    {
      "section": "clinical_notes",
      "field": "chief_complaint",
      "source_file": "D:\\Prime Agent\\patient_data\\Clinical_Notes\\Report_01_20260101_162553_handwritten.pdf",
      "source_lines": [],
      "source_excerpt": "Since last visit, patient reports approximately 7",
      "confidence": 0.8
    },
    {
      "section": "clinical_notes",
      "field": "history_of_present_illness",
      "source_file": "D:\\Prime Agent\\patient_data\\Clinical_Notes\\Report_01_20260101_162553_handwritten.pdf",
      "source_lines": [],
      "source_excerpt": "seizure episodes overall, average duration 3.4 mins, with seizure clustering: No.",
      "confidence": 0.8
    },
    {
      "section": "clinical_notes",
      "field": "diagnoses",
      "source_file": "D:\\Prime Agent\\patient_data\\Clinical_Notes\\Report_01_20260101_162553_handwritten.pdf",
      "source_lines": [],
      "source_excerpt": "Overall clinical impression: seizure control reasonably stable, quality-of-life trending",
      "confidence": 0.8
    },
    {
      "section": "clinical_notes",